{
  "name": "AlertDialog",
  "tagName": "sp-alert-dialog",
  "description": "Displays important information that users need to acknowledge. It provides a slot-based API for deep customization of the content to be included in the overlay.",
  "category": "Feedback",
  "attributes": [
    {
      "name": "variant",
      "type": "enum",
      "values": ["confirmation", "information", "warning", "error", "destructive", "secondary"],
      "description": "The variant defines the style and purpose of the alert dialog",
      "default": "confirmation",
      "valueDescriptions": {
        "confirmation": "Used for asking a user to confirm a choice",
        "information": "Communicates important information that a user needs to acknowledge",
        "warning": "Communicates important information related to an issue that needs acknowledgment",
        "error": "Communicates critical information about an issue that a user needs to acknowledge",
        "destructive": "For confirming actions that will impact data or experience in a potentially negative way",
        "secondary": "Allows for a three-button layout with primary, secondary, and cancel options"
      }
    }
  ],
  "slots": [
    {
      "name": "default",
      "description": "Content of the dialog body"
    },
    {
      "name": "heading",
      "description": "Dialog heading or title"
    },
    {
      "name": "button",
      "description": "Buttons for user actions (multiple buttons can be slotted here)"
    }
  ],
  "events": [
    {
      "name": "close",
      "description": "Dispatched when the dialog should be closed",
      "bubbles": true,
      "cancelable": false
    }
  ],
  "accessibility": {
    "role": "alertdialog",
    "ariaAttributes": [
      {
        "name": "aria-labelledby",
        "description": "References the ID of the heading element"
      },
      {
        "name": "aria-describedby",
        "description": "References the ID of the content that describes the purpose of the dialog"
      }
    ],
    "keyboardInteractions": [
      {
        "key": "Escape",
        "description": "Closes the dialog"
      },
      {
        "key": "Tab",
        "description": "Moves focus between focusable elements within the dialog"
      },
      {
        "key": "Enter",
        "description": "Activates the focused button"
      }
    ]
  },
  "examples": [
    {
      "title": "Confirmation Dialog",
      "description": "Default variant for asking a user to confirm a choice",
      "code": "<sp-alert-dialog variant=\"confirmation\">\n  <h2 slot=\"heading\">Disclaimer</h2>\n  Smart filters are nondestructive and will preserve your original images.\n  <sp-button slot=\"button\" variant=\"secondary\" treatment=\"outline\">Cancel</sp-button>\n  <sp-button slot=\"button\" variant=\"accent\" treatment=\"fill\">Enable</sp-button>\n</sp-alert-dialog>"
    },
    {
      "title": "Information Dialog",
      "description": "Communicates important information that needs acknowledgment",
      "code": "<sp-alert-dialog variant=\"information\">\n  <h2 slot=\"heading\">Connect to wifi</h2>\n  Please connect to wifi to sync your projects or go to Settings to change your preferences.\n  <sp-button slot=\"button\" variant=\"secondary\" treatment=\"outline\">Cancel</sp-button>\n  <sp-button slot=\"button\" variant=\"primary\" treatment=\"outline\">Continue</sp-button>\n</sp-alert-dialog>"
    },
    {
      "title": "Warning Dialog",
      "description": "Communicates important information related to an issue",
      "code": "<sp-alert-dialog variant=\"warning\">\n  <h2 slot=\"heading\">Unverified format</h2>\n  This format has not been verified and may not be viewable for some users. Do you want to continue publishing?\n  <sp-button slot=\"button\" variant=\"secondary\" treatment=\"outline\">Cancel</sp-button>\n  <sp-button slot=\"button\" variant=\"primary\" treatment=\"outline\">Continue</sp-button>\n</sp-alert-dialog>"
    },
    {
      "title": "Error Dialog",
      "description": "Communicates critical information about an issue",
      "code": "<sp-alert-dialog variant=\"error\">\n  <h2 slot=\"heading\">Unable to share</h2>\n  An error occured while sharing your project. Please verify the email address and try again.\n  <sp-button slot=\"button\" variant=\"primary\" treatment=\"outline\">Continue</sp-button>\n</sp-alert-dialog>"
    },
    {
      "title": "Destructive Dialog",
      "description": "For confirming actions with potentially negative impact",
      "code": "<sp-alert-dialog variant=\"destructive\">\n  <h2 slot=\"heading\">Delete 3 documents?</h2>\n  Are you sure you want to delete the 3 selected documents?\n  <sp-button slot=\"button\" variant=\"secondary\" treatment=\"outline\">Cancel</sp-button>\n  <sp-button slot=\"button\" variant=\"negative\" treatment=\"fill\">Delete</sp-button>\n</sp-alert-dialog>"
    }
  ],
  "implementation": {
    "goStructName": "spectrumAlertDialog",
    "constructorName": "AlertDialog",
    "dependsOn": ["Dialog", "Button"]
  },
  "relatedComponents": [
    {
      "name": "Dialog",
      "relationship": "AlertDialog is a specialized type of Dialog"
    },
    {
      "name": "Button",
      "relationship": "Used for action buttons in AlertDialog"
    },
    {
      "name": "AlertBanner",
      "relationship": "Less intrusive alternative for informational messages"
    }
  ]
}